{
  "metadata": {
    "schema_version": "0.1.0",
    "artifact_id": "REVIEW-DEMO-001",
    "artifact_type": "ReviewResult",
    "artifact_version": "0.1.0",
    "project_id": "PROJ-DEMO-001",
    "title": "示例：基金说明材料理解问卷 0.0.1 质量预审",
    "language": "zh-CN",
    "lifecycle_status": "DRAFT",
    "created_at": "2026-07-23T10:40:00+08:00",
    "updated_at": "2026-07-23T10:40:00+08:00",
    "created_by": {
      "actor_id": "AGENT-REVIEW-001",
      "actor_type": "AGENT",
      "role": "研究质量审核专家",
      "model_id": "demo-model",
      "capability_version": "0.1.0"
    },
    "upstream_refs": [
      {
        "artifact_id": "INS-SURVEY-DEMO-001",
        "artifact_type": "InstrumentSpec",
        "artifact_version": "0.0.1"
      }
    ],
    "content_classification": "SYNTHETIC",
    "sensitivity_level": "INTERNAL",
    "contains_personal_data": false,
    "change_summary": "记录示例问卷旧版本的双重问题与材料暴露缺口。"
  },
  "target_ref": {
    "artifact_id": "INS-SURVEY-DEMO-001",
    "artifact_type": "InstrumentSpec",
    "artifact_version": "0.0.1"
  },
  "review_scope": "InstrumentSpec",
  "review_types": [
    "STRUCTURE",
    "TRACEABILITY",
    "LOGIC",
    "WORDING",
    "PRIVACY",
    "COMPLIANCE",
    "FINANCIAL_EXPRESSION"
  ],
  "reviewer": {
    "actor_id": "AGENT-REVIEW-001",
    "actor_type": "AGENT",
    "role": "研究质量审核专家",
    "model_id": "demo-model",
    "capability_version": "0.1.0"
  },
  "reviewed_at": "2026-07-23T10:40:00+08:00",
  "ruleset_refs": [
    {
      "ruleset_id": "RULESET-INSTRUMENT-001",
      "version": "0.1.0",
      "uri": "../README.md"
    }
  ],
  "checks": [
    {
      "check_id": "CHECK-TRACE-001",
      "label": "核心题目与研究问题映射",
      "status": "PASS",
      "details": "旧版本中的核心理解题均关联 RQ-002 或 RQ-003。",
      "related_issue_ids": []
    },
    {
      "check_id": "CHECK-WORD-001",
      "label": "单题单一测量对象",
      "status": "FAIL",
      "details": "旧版本将材料清晰度和购买意向合并在同一道题中。",
      "related_issue_ids": [
        "ISSUE-001"
      ]
    },
    {
      "check_id": "CHECK-MATERIAL-001",
      "label": "材料暴露、理解、态度和意向分离",
      "status": "FAIL",
      "details": "旧版本没有单独记录材料是否成功打开和实际阅读。",
      "related_issue_ids": [
        "ISSUE-002"
      ]
    },
    {
      "check_id": "CHECK-FINANCE-001",
      "label": "收益承诺和产品推荐风险",
      "status": "PASS",
      "details": "未发现收益承诺，但材料和引导语仍需人工合规审核。",
      "related_issue_ids": []
    }
  ],
  "issues": [
    {
      "issue_id": "ISSUE-001",
      "severity": "MAJOR",
      "category": "DOUBLE_BARRELED",
      "rule_id": "RULE-SINGLE-CONSTRUCT-001",
      "location": {
        "json_pointer": "/survey_spec/sections/4/items/2",
        "component_id": "Q-CLARITY-AND-INTENT"
      },
      "description": "题目同时询问材料是否清晰以及参与者是否愿意购买，无法判断回答对应哪个概念。",
      "evidence": "题干使用“材料容易理解并让我愿意进一步购买”这一合并表述。",
      "recommended_change": "拆分为主观材料清晰度题和独立意向题；本研究不需要购买意向时应删除意向测量。",
      "status": "OPEN",
      "owner_role": "问卷设计专家"
    },
    {
      "issue_id": "ISSUE-002",
      "severity": "MAJOR",
      "category": "MATERIAL_CONFUSION",
      "rule_id": "RULE-EXPOSURE-SEPARATION-001",
      "location": {
        "json_pointer": "/material_measurement_plan",
        "component_id": "MAT-PRODUCT-001"
      },
      "description": "旧版本直接展示理解题，但没有单独确认参与者是否成功打开和实际阅读材料。",
      "evidence": "材料测量计划的 exposure_check_component_ids 为空，平台事件也未配置。",
      "recommended_change": "新增链接打开日志和自报阅读完成度；未完成暴露者不进入材料理解主分析。",
      "status": "OPEN",
      "owner_role": "问卷设计专家"
    }
  ],
  "summary": {
    "outcome": "CHANGES_REQUIRED",
    "blocker_count": 0,
    "major_count": 2,
    "minor_count": 0,
    "warning_count": 0,
    "summary_text": "结构可以读取，但材料暴露与测量对象存在两项重要设计问题；修订并完成预测试后才能进入 Gate 2 人工审核。"
  },
  "residual_risks": [
    {
      "risk_id": "RISK-REVIEW-001",
      "category": "COMPLIANCE",
      "description": "即使工具问题修复，示例材料的最终冻结版本仍需人工合规审核。",
      "likelihood": "MEDIUM",
      "impact": "HIGH",
      "mitigation": "在 Gate 2 提交完整材料版本、内容哈希和合规审核意见。",
      "owner_role": "合规审核人员"
    }
  ],
  "recommended_next_action": "REVISE_TARGET",
  "is_formal_approval": false
}
